MAIRPD Implicit Regional Price Deflators by MSA,,,,,,,,,,,,
Implicit regional price deflator (Index) ,,,,,,,,,,,,
Bureau of Economic Analysis ,,,,,,,,,,,,
Metropolitan Statistical Area,,,,,,,,,,,,
GeoFips,GeoName,2009,2010,2011,2012,2013,2014,2015,2016,2017,2018,2019
999,United States (Nonmetropolitan Portion) 1/,81.2,83.2,85.5,87.3,89,90.3,90.3,91,92.5,93.7,94.5
10180,"Abilene, TX (Metropolitan Statistical Area)",84.1,86.1,88.6,91,91.8,93.5,93.3,94,94.6,97.4,98.3
10420,"Akron, OH (Metropolitan Statistical Area)",82.8,84.3,86.9,88.4,90.4,92.3,92.8,93.5,95.2,96.9,98
10500,"Albany, GA (Metropolitan Statistical Area)",78.3,80.2,82.6,84.2,85.2,86.1,86.1,86.4,87.2,88.9,90.2
10540,"Albany-Lebanon, OR (Metropolitan Statistical Area)",89.8,90.7,91.7,92.7,94.6,97.1,96.5,99.5,102.1,104.9,106.7
10580,"Albany-Schenectady-Troy, NY (Metropolitan Statistical Area)",93.2,94,96.3,98.6,100.6,102.8,103.4,103.9,104.7,106.5,108.1
10740,"Albuquerque, NM (Metropolitan Statistical Area)",90.9,92.5,95,96.7,98.4,99.2,98.9,98.2,98.9,100.4,101.9
10780,"Alexandria, LA (Metropolitan Statistical Area)",81.2,82.8,84.3,87.2,88.8,90.8,90.6,90.3,91,91.9,93
10900,"Allentown-Bethlehem-Easton, PA-NJ (Metropolitan Statistical Area)",94.2,95.3,97.7,99.4,101.3,103.6,103.9,104,104.2,106.2,107.4
11020,"Altoona, PA (Metropolitan Statistical Area)",83.8,85.6,88.6,91.2,91.2,92.9,92.7,93.4,94.4,96.5,98.1
11100,"Amarillo, TX (Metropolitan Statistical Area)",88,88.6,90.6,92.6,93.9,95.1,95.5,95.7,96.7,98.1,99.4
11180,"Ames, IA (Metropolitan Statistical Area)",84.1,85.4,87.8,89.3,91.1,93.2,93.8,94,96.9,98.8,99.9
11260,"Anchorage, AK (Metropolitan Statistical Area)",104.3,105,106.9,107.9,109.4,111.3,111.3,112.6,114.3,115.6,116
11460,"Ann Arbor, MI (Metropolitan Statistical Area)",96.4,97.3,99.7,101.2,102.5,103.9,104.1,104.4,105.5,107.9,109.5
11500,"Anniston-Oxford, AL (Metropolitan Statistical Area)",78.5,79.6,81.7,84.6,85.9,86.3,86.5,86.1,87.6,88.6,89.7
11540,"Appleton, WI (Metropolitan Statistical Area)",87,88.4,91,92.9,93.9,94.4,93.7,93.9,94.6,96,96.8
11700,"Asheville, NC (Metropolitan Statistical Area)",87.1,88.1,90,91.8,93.5,95.4,95.3,96.2,97.7,100.2,101.8
12020,"Athens-Clarke County, GA (Metropolitan Statistical Area)",87.9,88.4,89.7,91.1,92.6,94.2,94.2,94.3,96,97.8,99.1
12060,"Atlanta-Sandy Springs-Alpharetta, GA (Metropolitan Statistical Area)",92.1,92.2,93.6,95.4,97,98.5,99,100.3,102.4,104.7,106.6
12100,"Atlantic City-Hammonton, NJ (Metropolitan Statistical Area)",102.3,102.8,104.4,106.6,107.7,108.6,107.2,105.5,104.4,106.1,107.4
12220,"Auburn-Opelika, AL (Metropolitan Statistical Area)",81.7,82.7,84.9,86.3,87.8,88.2,86.9,87.2,88.1,91.4,92.7
12260,"Augusta-Richmond County, GA-SC (Metropolitan Statistical Area)",83.7,84.8,87.4,89.1,90.6,91,90.9,91.5,93.3,95.3,97.2
12420,"Austin-Round Rock-Georgetown, TX (Metropolitan Statistical Area)",93,93.9,96.1,98,99.6,101.5,102.3,103,104.2,106.6,108.2
12540,"Bakersfield, CA (Metropolitan Statistical Area)",91.7,93.4,95.9,97.6,99.1,99.8,99.4,100.3,102.4,104.2,105.7
12580,"Baltimore-Columbia-Towson, MD (Metropolitan Statistical Area)",101.6,103.8,106.1,107.1,108.4,110.1,110.4,110.9,111.9,113.8,115.2
12620,"Bangor, ME (Metropolitan Statistical Area)",90.5,91.3,94.3,96.1,98.1,99.3,99.6,100.1,102.5,104.2,105.9
12700,"Barnstable Town, MA (Metropolitan Statistical Area)",96.9,98.1,99.4,101.6,103.1,105.5,106.1,108.5,111.4,113.8,115.7
12940,"Baton Rouge, LA (Metropolitan Statistical Area)",86.9,88.1,90.5,92.7,93.8,95.4,95.3,95.6,96,97.7,98.5
12980,"Battle Creek, MI (Metropolitan Statistical Area)",85.7,86.9,88.7,90.4,91.7,93.1,92.4,92.5,93,93.9,94.7
13020,"Bay City, MI (Metropolitan Statistical Area)",84.8,84.6,86.5,88.6,90.6,91.5,89.9,89.1,89.9,91.6,93.5
13140,"Beaumont-Port Arthur, TX (Metropolitan Statistical Area)",83.8,84.9,87.7,89.8,91.4,92.3,92.6,92.7,93.1,93.9,95.1
13220,"Beckley, WV (Metropolitan Statistical Area)",69.1,73,73.9,76.3,78.1,80.8,81.1,81.8,80,82.5,84.7
13380,"Bellingham, WA (Metropolitan Statistical Area)",92.6,94.5,97.6,99.4,101.3,102.2,102,103.2,105.3,108.4,110.6
13460,"Bend, OR (Metropolitan Statistical Area)",91.7,92.5,93.3,95,97,99.2,99.8,104,108.1,110.4,111.6
13740,"Billings, MT (Metropolitan Statistical Area)",90.1,91.2,93.6,95.3,98.3,99.6,100.4,99.2,100.3,101.2,102.8
13780,"Binghamton, NY (Metropolitan Statistical Area)",88.7,90.2,92.7,95,96.1,98.1,98.5,99.2,100.3,102.1,103.4
13820,"Birmingham-Hoover, AL (Metropolitan Statistical Area)",84.9,86.1,88.1,89.6,90.7,91.8,91.7,91.7,92.3,94.4,96.1
13900,"Bismarck, ND (Metropolitan Statistical Area)",86.4,87.4,89.7,91.9,94.1,95.8,95.4,97.1,98.2,99.4,100.1
13980,"Blacksburg-Christiansburg, VA (Metropolitan Statistical Area)",83.7,85.2,87.8,88.5,89.9,90.5,91.5,91.7,93.5,95.9,98.2
14010,"Bloomington, IL (Metropolitan Statistical Area)",87.7,88.7,91.4,93.4,94.6,96.1,95.5,96.4,97.2,98.5,99.7
14020,"Bloomington, IN (Metropolitan Statistical Area)",89.1,89.6,93,94.6,96.4,97,96,95.9,96.8,98.2,99.7
14100,"Bloomsburg-Berwick, PA (Metropolitan Statistical Area)",86.5,88.9,90.3,92.1,93.4,96,97.1,96.8,97.8,98.8,100.7
14260,"Boise City, ID (Metropolitan Statistical Area)",89.9,91.3,93.3,94.9,96.2,97.2,96.7,96.6,97.2,99.7,102
14460,"Boston-Cambridge-Newton, MA-NH (Metropolitan Statistical Area)",104.6,106.2,108.8,110.4,111.1,112.9,113.7,116.9,120,123.4,125.8
14500,"Boulder, CO (Metropolitan Statistical Area)",99.8,103,106.1,108.1,110.6,111.5,111.5,111.1,112.2,114,116.1
14540,"Bowling Green, KY (Metropolitan Statistical Area)",79.1,80.7,82.8,84.9,86.7,88,87.8,87.9,89,90.5,92.2
14740,"Bremerton-Silverdale-Port Orchard, WA (Metropolitan Statistical Area)",97.4,99.2,102.2,104.4,106.9,108.9,109.5,110.5,112.8,115.8,118.4
14860,"Bridgeport-Stamford-Norwalk, CT (Metropolitan Statistical Area)",114.8,115.7,118.2,120,120.7,121.8,121.7,120.4,119.9,121.5,122.4
15180,"Brownsville-Harlingen, TX (Metropolitan Statistical Area)",78.5,80.3,82.6,84.6,86.1,87,86.2,86.2,86.7,88.4,89.5
15260,"Brunswick, GA (Metropolitan Statistical Area)",79.3,81.4,83.4,85.2,86.8,87.9,88.7,89.3,91.6,94.7,95.6
15380,"Buffalo-Cheektowaga, NY (Metropolitan Statistical Area)",87.9,89,91.4,93.3,95.1,97,97.5,97.7,98.9,101.1,102.9
15500,"Burlington, NC (Metropolitan Statistical Area)",86.3,86.7,88.4,89.4,91,92.4,92.4,92.8,93.9,96,97.5
15540,"Burlington-South Burlington, VT (Metropolitan Statistical Area)",96.1,96.9,99.2,101.5,103.6,106.5,107.1,109.5,111.9,114.2,115.6
15680,"California-Lexington Park, MD (Metropolitan Statistical Area)",93.2,94,96.1,98.7,99.8,101.3,101.3,104.4,104.8,105.6,104.9
15940,"Canton-Massillon, OH (Metropolitan Statistical Area)",83.9,85.4,87.5,88.9,89.9,91.1,90.3,90.5,91.3,92.4,92.8
15980,"Cape Coral-Fort Myers, FL (Metropolitan Statistical Area)",93.3,92.6,93.8,94.8,96,97.3,97.9,99.5,101.8,104.8,106.3
16020,"Cape Girardeau, MO-IL (Metropolitan Statistical Area)",74.9,76.8,79.9,83.6,85.2,86.2,85.2,86,87.7,90.5,92.2
16060,"Carbondale-Marion, IL (Metropolitan Statistical Area)",76,78.1,81.8,84,85.6,86.7,86.4,87.6,88,89.9,90.6
16180,"Carson City, NV (Metropolitan Statistical Area)",94.4,94.9,95.9,96.6,98.2,99.1,98.3,98.6,100.3,103.4,105.4
16220,"Casper, WY (Metropolitan Statistical Area)",89,91.8,95.6,97.8,99.5,100,99.7,99.4,99.4,101.1,101.3
16300,"Cedar Rapids, IA (Metropolitan Statistical Area)",85.1,86.9,89.3,91.1,91.9,92.3,91.2,91.5,93.4,94.8,96.3
16540,"Chambersburg-Waynesboro, PA (Metropolitan Statistical Area)",88.8,90,92.1,94,95.6,97.6,97.4,97.5,98.7,100.9,102.7
16580,"Champaign-Urbana, IL (Metropolitan Statistical Area)",88.4,89.4,92,93.4,94.7,95.3,95.3,96.3,97.8,98.7,99.1
16620,"Charleston, WV (Metropolitan Statistical Area)",82.6,84.3,87.3,89.5,89.8,90.6,89.7,90,90.8,92.7,93.6
16700,"Charleston-North Charleston, SC (Metropolitan Statistical Area)",90.1,91,93.5,95.4,96.9,98.5,98.7,99.8,101.2,103.8,105.7
16740,"Charlotte-Concord-Gastonia, NC-SC (Metropolitan Statistical Area)",88.3,88.9,91,92.9,94.3,95.7,96,96.9,98.6,101,102.8
16820,"Charlottesville, VA (Metropolitan Statistical Area)",93.3,93.9,96.4,97.7,99.3,100.2,100.7,102.2,104,106.2,107.6
16860,"Chattanooga, TN-GA (Metropolitan Statistical Area)",85,85.8,87.9,90,91.3,92.4,92.3,91.6,92.4,94.6,96.9
16940,"Cheyenne, WY (Metropolitan Statistical Area)",89.1,90.7,94.3,96.4,98.8,99.5,99.7,99.2,100,100.6,100.6
16980,"Chicago-Naperville-Elgin, IL-IN-WI (Metropolitan Statistical Area)",100.3,101.7,104.4,105.8,105.5,106.3,106.4,107.1,108.3,110.4,111.9
17020,"Chico, CA (Metropolitan Statistical Area)",93.8,95.4,98.1,100.2,101.6,102.1,101.3,102.7,105.3,107.8,109.5
17140,"Cincinnati, OH-KY-IN (Metropolitan Statistical Area)",86.9,87.3,88.8,89.9,90.4,92.1,92.5,93.2,95.5,97.4,98.6
17300,"Clarksville, TN-KY (Metropolitan Statistical Area)",84.2,85.4,88.3,90.6,92.3,93.3,93.3,92.6,93.1,94.9,96.1
17420,"Cleveland, TN (Metropolitan Statistical Area)",78.5,79.8,82,83.3,85.1,86.6,86.5,86.1,87,90.8,93.1
17460,"Cleveland-Elyria, OH (Metropolitan Statistical Area)",83.7,85.1,87.6,89.1,90.8,92.5,92.9,93.6,95.1,96.8,97.9
17660,"Coeur d'Alene, ID (Metropolitan Statistical Area)",89.6,89.9,91.5,92.5,94.2,96.1,96.4,96.9,98.6,101.2,101.8
17780,"College Station-Bryan, TX (Metropolitan Statistical Area)",87.4,88.4,91.5,93.8,95.1,96.2,96,96,96.8,99,99.4
17820,"Colorado Springs, CO (Metropolitan Statistical Area)",92.5,94,96.9,98.7,100.7,101.8,101.8,101.5,102.8,105.7,108.1
17860,"Columbia, MO (Metropolitan Statistical Area)",87.4,88.4,90.7,92.5,93.5,94.8,93.4,92.9,94.1,95.8,97.9
17900,"Columbia, SC (Metropolitan Statistical Area)",86.9,87.8,90,91.8,93,94,94.2,95.2,96.5,98.4,99.5
17980,"Columbus, GA-AL (Metropolitan Statistical Area)",84.2,84.9,87.6,88.7,90.1,91.4,91.7,92.5,93.6,95.3,96.5
18020,"Columbus, IN (Metropolitan Statistical Area)",80.6,82.1,85.3,88.2,89.2,90.6,90.2,92.2,93.7,95.9,96.6
18140,"Columbus, OH (Metropolitan Statistical Area)",87.7,88.9,91.4,93.2,94.3,95.3,94.5,95.1,96.6,98.4,99.8
18580,"Corpus Christi, TX (Metropolitan Statistical Area)",87.1,88.3,90.1,92.2,93.9,95.5,95.8,96.3,97.4,99.3,100.6
18700,"Corvallis, OR (Metropolitan Statistical Area)",92.2,92.8,94.6,96,98.6,102.1,102.3,105.4,108.6,111,112
18880,"Crestview-Fort Walton Beach-Destin, FL (Metropolitan Statistical Area)",90.7,91.2,93.3,95.3,96.6,97.4,97.4,98.4,99.5,101.3,102.9
19060,"Cumberland, MD-WV (Metropolitan Statistical Area)",82.5,84.3,85.9,87.6,88,89.6,89.7,91.3,91,92.3,91.2
19100,"Dallas-Fort Worth-Arlington, TX (Metropolitan Statistical Area)",95.3,96.1,98.2,99.7,100.8,102.3,102.1,103.1,105.4,108.1,110.1
19140,"Dalton, GA (Metropolitan Statistical Area)",80.1,82,82.5,84.2,85.2,86.1,86.6,87.1,88.5,90.7,93.4
19180,"Danville, IL (Metropolitan Statistical Area)",71.4,75.2,77.5,80.3,81,83.2,83.1,83.5,83.9,84.8,86.1
19300,"Daphne-Fairhope-Foley, AL (Metropolitan Statistical Area)",88.6,89.3,91.3,92.7,93.3,94.2,93.3,93.7,94.1,96.2,98.3
19340,"Davenport-Moline-Rock Island, IA-IL (Metropolitan Statistical Area)",85.9,87.2,89.5,91.6,92.3,93,91.7,92.1,93.2,95,96.1
19430,"Dayton-Kettering, OH (Metropolitan Statistical Area)",86.2,87.5,89.6,90.8,91.6,92.5,91.8,92.2,93.1,94.5,95.4
19460,"Decatur, AL (Metropolitan Statistical Area)",81,83.1,84.4,85.8,87.4,88.5,88.5,86.4,86,88.9,91.1
19500,"Decatur, IL (Metropolitan Statistical Area)",84.3,85.1,87.9,89.4,90.8,90.4,88.7,88,89.2,91.3,92.5
19660,"Deltona-Daytona Beach-Ormond Beach, FL (Metropolitan Statistical Area)",92,91.7,93.4,94.9,96.4,97.8,98.1,98.9,100.2,102.8,104.3
19740,"Denver-Aurora-Lakewood, CO (Metropolitan Statistical Area)",96.5,99,101.7,103.2,105.4,106.7,107.3,108.1,110.2,112.1,113.4
19780,"Des Moines-West Des Moines, IA (Metropolitan Statistical Area)",88.9,90.1,92.8,94.3,95.7,96.7,96.3,96.3,97.6,99.2,100.5
19820,"Detroit-Warren-Dearborn, MI (Metropolitan Statistical Area)",93,93.9,96,97.1,98,99,98.7,98.9,100.2,102.2,103.8
20020,"Dothan, AL (Metropolitan Statistical Area)",79.1,80.4,82.9,84.3,86,87,86.8,86.5,87.1,89.5,91
20100,"Dover, DE (Metropolitan Statistical Area)",88.9,88.8,91.7,93.7,94.6,96.5,96.8,97.9,98.1,98.9,100.7
20220,"Dubuque, IA (Metropolitan Statistical Area)",85.6,87.4,90,92.1,93.5,94.6,93.6,93.7,94.6,95.9,97
20260,"Duluth, MN-WI (Metropolitan Statistical Area)",87.2,87.5,90.1,91.1,92.3,93.4,92.1,92.5,93.8,96.3,97.5
20500,"Durham-Chapel Hill, NC (Metropolitan Statistical Area)",90.2,90.6,92.9,94.6,96.1,97.6,97.9,98,99.4,101.7,103.2
20700,"East Stroudsburg, PA (Metropolitan Statistical Area)",93,94.1,96.2,97.9,100.1,102.3,102.6,100.6,101,103.6,107.1
20740,"Eau Claire, WI (Metropolitan Statistical Area)",87,88,90.3,92,93,93.8,92.9,93.2,94.2,95.7,97
20940,"El Centro, CA (Metropolitan Statistical Area)",85.7,87.3,89.1,90.9,92,93.2,92.5,93.9,96.2,97.5,98.4
21060,"Elizabethtown-Fort Knox, KY (Metropolitan Statistical Area)",80.5,82.4,85.3,86.4,87.9,88.3,88.3,88.1,89,91.8,94.2
21140,"Elkhart-Goshen, IN (Metropolitan Statistical Area)",87.5,88.6,90.2,91.5,91.9,92.7,92.4,92.4,93.5,95,96.7
21300,"Elmira, NY (Metropolitan Statistical Area)",87.6,89.2,91.8,93.9,95.5,97.7,98.1,98.5,99.6,101.8,103.4
21340,"El Paso, TX (Metropolitan Statistical Area)",84,85.2,88.2,90.3,91.6,92.1,91.6,91.2,92.5,94.4,95.5
21420,"Enid, OK (Metropolitan Statistical Area) 2/",(NA),(NA),(NA),(NA),88.3,90.4,92.1,92.8,93.9,95.5,96.1
21500,"Erie, PA (Metropolitan Statistical Area)",86.3,87.6,90.1,92.5,94,95.7,95.8,96.1,96.6,98.4,99.4
21660,"Eugene-Springfield, OR (Metropolitan Statistical Area)",91.6,93.2,96.2,97.9,99.8,100.3,100.1,101.5,104.3,106.5,108.3
21780,"Evansville, IN-KY (Metropolitan Statistical Area)",85.6,87.2,89.7,91.1,91.9,92.4,91.2,91.4,92.9,94.3,95.3
21820,"Fairbanks, AK (Metropolitan Statistical Area)",99,100.6,103,105.3,107.9,109.7,109.9,111.6,114.8,115.9,116.3
22020,"Fargo, ND-MN (Metropolitan Statistical Area)",87.4,88.9,91.3,93.3,94.3,95.3,94.1,94.6,95.8,97.9,98.6
22140,"Farmington, NM (Metropolitan Statistical Area)",85.8,87.7,88.7,91.4,92.1,93.8,92.8,93.8,94.8,97.4,98.3
22180,"Fayetteville, NC (Metropolitan Statistical Area)",85.9,86.9,89.1,91,92.2,93.5,93,92.3,93.1,95.2,96.9
22220,"Fayetteville-Springdale-Rogers, AR (Metropolitan Statistical Area)",84.9,85.7,88.2,90.2,91.5,92.3,92.3,92.4,93.1,94.5,96
22380,"Flagstaff, AZ (Metropolitan Statistical Area)",93,93.7,95.6,97,99.5,101.3,101.7,101,103.1,105.4,108.2
22420,"Flint, MI (Metropolitan Statistical Area)",88.3,89.8,91.9,93.2,94,94.5,93.7,93.1,93.8,95.7,96.6
22500,"Florence, SC (Metropolitan Statistical Area)",79.2,81.1,83.7,85.3,87.1,87.7,87.8,88.7,90.9,93.2,95.3
22520,"Florence-Muscle Shoals, AL (Metropolitan Statistical Area)",76.6,79.6,81.8,84.1,84.5,86.1,85.8,86.3,86.8,87.7,87.9
22540,"Fond du Lac, WI (Metropolitan Statistical Area)",80.1,81.7,84.7,86.7,88.3,90.2,89.9,90.7,91.9,94,95.6
22660,"Fort Collins, CO (Metropolitan Statistical Area)",92.6,95,98.3,100.5,102.6,103.6,103.9,104,105.6,108.7,111
22900,"Fort Smith, AR-OK (Metropolitan Statistical Area)",80.4,81.9,83.7,85.6,86.6,87.8,87.6,87.9,87.9,89,90.3
23060,"Fort Wayne, IN (Metropolitan Statistical Area)",85.8,86.8,89,90.7,91.4,92.1,91.2,92,93.4,95,95.9
23420,"Fresno, CA (Metropolitan Statistical Area)",91.9,93.4,96.3,97.8,99,99.2,98.8,100,102.1,104.3,106.1
23460,"Gadsden, AL (Metropolitan Statistical Area)",78.3,81.6,82.9,83.8,84.5,86.4,86.9,85.6,85.4,87.7,89.5
23540,"Gainesville, FL (Metropolitan Statistical Area)",92.7,93.3,94.6,95.7,96.5,97.5,97.1,97.1,98.3,101.1,102.8
23580,"Gainesville, GA (Metropolitan Statistical Area)",85,85.7,88.3,90.4,91.4,91.4,91.5,92.4,94.1,97.2,99.3
23900,"Gettysburg, PA (Metropolitan Statistical Area)",90,91,93.2,95.2,97.3,99,99.4,99.4,100.2,102.5,104.1
24020,"Glens Falls, NY (Metropolitan Statistical Area)",91,92,94.4,96.6,98.5,100.2,99.9,99.8,101.2,103.5,105.1
24140,"Goldsboro, NC (Metropolitan Statistical Area)",80.3,83,85,86.5,88.3,89.5,90,90.1,91.3,93.3,94.8
24220,"Grand Forks, ND-MN (Metropolitan Statistical Area)",87.7,88.8,91,92.3,93.7,95.5,95.3,95.2,95.3,97.4,97.3
24260,"Grand Island, NE (Metropolitan Statistical Area)",77.1,78.9,81.8,84.6,86.3,88.1,88.4,88.6,89.2,91,93.1
24300,"Grand Junction, CO (Metropolitan Statistical Area)",91.1,92.1,93.3,94.1,95.8,97.5,97.3,96.9,98,99.8,102
24340,"Grand Rapids-Kentwood, MI (Metropolitan Statistical Area)",87.8,88.8,91,92.7,94.1,95.6,95.1,95.6,97,98.7,100.2
24420,"Grants Pass, OR (Metropolitan Statistical Area)",89,89,91.5,92.7,94.8,96.7,96.9,98.1,99.7,101.1,104
24500,"Great Falls, MT (Metropolitan Statistical Area)",85.7,89,91.8,94.1,95.3,95.4,95.5,94.5,96.1,98.5,100.1
24540,"Greeley, CO (Metropolitan Statistical Area)",91.9,93.5,95.2,96.4,98.5,100.5,100.7,100.8,102.3,104,106.7
24580,"Green Bay, WI (Metropolitan Statistical Area)",86.1,87.6,90.1,91.8,92.9,93.9,93,93.3,94.5,96.2,97.7
24660,"Greensboro-High Point, NC (Metropolitan Statistical Area)",85.7,86.3,88.4,90,91,92.3,92.5,93.3,94.4,96.3,98
24780,"Greenville, NC (Metropolitan Statistical Area)",84.5,85.2,87.1,88.8,89.5,90.7,90.5,91,92.2,93.3,95.2
24860,"Greenville-Anderson, SC (Metropolitan Statistical Area)",85.1,86,88.4,89.9,91.1,92.2,92.2,93,94.6,96.9,98.7
25060,"Gulfport-Biloxi, MS (Metropolitan Statistical Area)",88.9,89.1,89.9,90.6,91.4,92.4,91.9,91.4,91.7,93.5,95
25180,"Hagerstown-Martinsburg, MD-WV (Metropolitan Statistical Area)",97.8,97.9,100.4,101.9,103.4,103.9,103.1,101.6,101.5,103.3,104.7
25220,"Hammond, LA (Metropolitan Statistical Area)",79.9,81.6,83.8,84.9,86.7,87.5,88.1,88,90.2,91.8,94
25260,"Hanford-Corcoran, CA (Metropolitan Statistical Area)",90.4,91.2,92.9,94.1,95.1,95.7,95.5,98.8,101.3,103.5,103.6
25420,"Harrisburg-Carlisle, PA (Metropolitan Statistical Area)",90.8,91.8,94.2,96,97.7,99.3,99.6,100,100.9,103.1,104.4
25500,"Harrisonburg, VA (Metropolitan Statistical Area)",87.4,88,90.3,91.7,93.6,93.7,92.1,92.3,94.2,97.3,100
25540,"Hartford-East Hartford-Middletown, CT (Metropolitan Statistical Area)",95.1,96,98.3,100.4,101.9,104.1,104.4,106,108.2,110.2,111.6
25620,"Hattiesburg, MS (Metropolitan Statistical Area)",79.3,80.7,82.1,84.1,85.9,86.5,84.8,85.4,86.2,90,92.2
25860,"Hickory-Lenoir-Morganton, NC (Metropolitan Statistical Area)",84.4,85.4,87.6,88.6,89.9,90.5,90.1,90.2,91.4,93.8,95.1
25940,"Hilton Head Island-Bluffton, SC (Metropolitan Statistical Area)",90.7,90.8,91.6,93.5,95.3,96.4,96.3,98.5,100.7,102.3,103.6
25980,"Hinesville, GA (Metropolitan Statistical Area)",82.5,84.9,87.4,91.6,92.4,94,92.7,94,94.7,98.3,99.7
26140,"Homosassa Springs, FL (Metropolitan Statistical Area)",86.6,86.2,87.9,89.6,90.5,90.8,90.1,91.1,92.3,95.2,97
26300,"Hot Springs, AR (Metropolitan Statistical Area)",79.2,80.4,82.9,85,86.5,87.1,87,87.9,90.1,91.5,92.6
26380,"Houma-Thibodaux, LA (Metropolitan Statistical Area)",83.9,86.1,89.5,91.8,93.5,94.9,93.8,93.4,93.6,95,95.9
26420,"Houston-The Woodlands-Sugar Land, TX (Metropolitan Statistical Area)",94.4,95.9,98.4,99.7,101.4,103.4,103.7,104.9,106.9,109.2,110.8
26580,"Huntington-Ashland, WV-KY-OH (Metropolitan Statistical Area)",80.1,82.1,85.1,86.4,88,88.4,88.5,89.5,90.2,91.9,93.2
26620,"Huntsville, AL (Metropolitan Statistical Area)",85.6,86.6,88.9,90.8,92,92.7,92.4,91.8,93,95,96.9
26820,"Idaho Falls, ID (Metropolitan Statistical Area)",86.5,87.9,89.2,90,91.6,91.5,92,92.7,95.8,97.6,99.1
26900,"Indianapolis-Carmel-Anderson, IN (Metropolitan Statistical Area)",88.2,89.3,91.7,93.3,94.3,95.2,94.4,94.8,96.1,98,99.2
26980,"Iowa City, IA (Metropolitan Statistical Area)",89.8,90.8,93.4,95.6,96.8,98.4,97.6,97.9,98.8,100.3,101.1
27060,"Ithaca, NY (Metropolitan Statistical Area)",97.7,98.4,101,103.6,105.4,108.4,109.3,110.2,111.2,112.9,114.7
27100,"Jackson, MI (Metropolitan Statistical Area)",85,85.7,88.2,90.7,92.2,92.5,91.4,91.6,92.7,94.2,95.3
27140,"Jackson, MS (Metropolitan Statistical Area)",84.9,86.1,88.6,90.3,91.5,92.5,92.6,92.1,92.8,95.1,95.5
27180,"Jackson, TN (Metropolitan Statistical Area)",77.6,78.9,80.4,82.9,84.1,84.8,84.1,83.5,84.9,86.7,87.8
27260,"Jacksonville, FL (Metropolitan Statistical Area)",91.5,92.2,94.2,95.9,96.9,98.2,98.4,99.3,100.3,102.3,103.9
27340,"Jacksonville, NC (Metropolitan Statistical Area)",88.5,90.4,93.3,95.5,95.9,96.5,95.7,96.1,97.3,98.8,99.8
27500,"Janesville-Beloit, WI (Metropolitan Statistical Area)",87,88.1,91.1,92.5,93.2,94.2,93.2,93.7,94.3,96.2,97.5
27620,"Jefferson City, MO (Metropolitan Statistical Area)",75.7,77.1,79.2,81.6,83.5,84.9,84.8,85.6,86.5,88.1,90.6
27740,"Johnson City, TN (Metropolitan Statistical Area)",83,83.9,85.6,88,88.8,90.2,90.2,90.3,90.5,91.6,92.9
27780,"Johnstown, PA (Metropolitan Statistical Area)",77.4,81.7,85,86.7,87,88.3,88.9,89.7,90.4,92.1,92.7
27860,"Jonesboro, AR (Metropolitan Statistical Area)",74.1,76.4,79.9,81.5,83,84,84,84.4,86.2,89.1,91.2
27900,"Joplin, MO (Metropolitan Statistical Area)",81.6,83.9,85.7,87.6,88.7,89.5,89.4,89.9,90.8,91.2,91
27980,"Kahului-Wailuku-Lahaina, HI (Metropolitan Statistical Area)",101.5,104,105.4,106.9,108.5,109.8,110,113.1,118.5,120.2,123.3
28020,"Kalamazoo-Portage, MI (Metropolitan Statistical Area)",87.8,88.9,90.6,92.3,93.1,94.2,93.2,93.7,95,96.7,97.8
28100,"Kankakee, IL (Metropolitan Statistical Area)",91.4,93.1,96.4,98.3,98.5,99.5,99.3,98.5,98,99.5,101.2
28140,"Kansas City, MO-KS (Metropolitan Statistical Area)",87.1,88.5,91.7,93.3,95.1,96.6,96,96.2,97.6,99.5,101
28420,"Kennewick-Richland, WA (Metropolitan Statistical Area)",89.6,91.7,95.1,97.3,99.3,100.1,99.4,100.7,103,105.2,107.4
28660,"Killeen-Temple, TX (Metropolitan Statistical Area)",86.9,87.9,90.2,92.2,93.6,94.9,94.6,94.2,94.5,96,97
28700,"Kingsport-Bristol, TN-VA (Metropolitan Statistical Area)",81.6,82.3,84.4,85.9,87.4,88.2,87.6,87.7,88.7,90.6,92
28740,"Kingston, NY (Metropolitan Statistical Area)",97.4,98.1,99.9,102,104.3,107,107.5,107.3,108,110.1,111.8
28940,"Knoxville, TN (Metropolitan Statistical Area)",84.2,85.2,87.7,90,91.6,92.5,91.8,91.2,92.1,94.5,96.3
29020,"Kokomo, IN (Metropolitan Statistical Area)",81.3,83.7,86.5,87.9,88.7,88.9,87.9,87.8,90.4,91.9,93
29100,"La Crosse-Onalaska, WI-MN (Metropolitan Statistical Area)",87,88.5,91.4,93.3,93.8,94.9,94.2,95.1,96,97.8,98.9
29180,"Lafayette, LA (Metropolitan Statistical Area)",82.2,83.3,86.7,88,89.8,91,91.3,91,90.8,92.2,93.2
29200,"Lafayette-West Lafayette, IN (Metropolitan Statistical Area)",88.2,89.3,91.7,93.6,95.2,95.8,95,94.3,95.2,96.3,97.8
29340,"Lake Charles, LA (Metropolitan Statistical Area)",82.9,84.2,86.2,88.2,89.9,90.9,91.1,90.6,92.9,94.6,96.5
29420,"Lake Havasu City-Kingman, AZ (Metropolitan Statistical Area)",90.2,91.2,93.1,94,95.5,95.5,94.6,93.7,94.2,96,97.2
29460,"Lakeland-Winter Haven, FL (Metropolitan Statistical Area)",90,90,92,93.5,94.5,95.4,95.4,96.4,97.8,99.9,101.8
29540,"Lancaster, PA (Metropolitan Statistical Area)",92.4,93.3,95.5,97.9,99.9,102,102.4,102.9,103.9,105.5,106.8
29620,"Lansing-East Lansing, MI (Metropolitan Statistical Area)",89.6,90.3,92.4,94.1,94.8,95.7,94.6,94.5,95.9,97.7,98.4
29700,"Laredo, TX (Metropolitan Statistical Area)",83.5,84.7,87.1,88.5,89.8,90.5,91.2,91.8,91.9,93,93.7
29740,"Las Cruces, NM (Metropolitan Statistical Area)",86.3,88.3,90.7,92.6,93.8,94.6,93.9,92.9,92.6,93.1,93.3
29820,"Las Vegas-Henderson-Paradise, NV (Metropolitan Statistical Area)",95.3,96.6,98.6,99.6,100.8,100.9,100.3,99.7,100.7,103.2,105.5
29940,"Lawrence, KS (Metropolitan Statistical Area)",89.4,90.9,93.6,95.2,96,96.3,94.5,94.8,95.7,98.4,99.2
30020,"Lawton, OK (Metropolitan Statistical Area)",84.1,85.7,88.8,90.6,92.1,93,92.9,92.4,93,94.5,95.3
30140,"Lebanon, PA (Metropolitan Statistical Area)",89.4,90.3,92.4,94.3,95.7,98.1,98.6,98.9,99.7,102.4,104.2
30300,"Lewiston, ID-WA (Metropolitan Statistical Area)",85.1,86.8,88.3,90.2,91.4,92.7,93.2,93.7,95.1,96.8,98.8
30340,"Lewiston-Auburn, ME (Metropolitan Statistical Area)",89.5,90.5,92.4,94.3,96.5,98,97.8,98.7,101.2,103.1,104.6
30460,"Lexington-Fayette, KY (Metropolitan Statistical Area)",87.8,88.2,90.3,91.8,93.2,94.5,94.3,93.7,94.2,96.5,98.6
30620,"Lima, OH (Metropolitan Statistical Area)",82.8,84.4,86,88.5,89.7,91.1,90,89.2,89.5,90.1,91.5
30700,"Lincoln, NE (Metropolitan Statistical Area)",87.3,88.7,90.9,92.6,93.6,94.7,94.1,94.5,95.7,97.6,98.9
30780,"Little Rock-North Little Rock-Conway, AR (Metropolitan Statistical Area)",85.9,87.2,89.4,90.7,91.8,92.7,93.3,93.1,94,95,95.5
30860,"Logan, UT-ID (Metropolitan Statistical Area)",86.6,87.3,88.7,89.4,91.2,92.8,92.9,93.7,95.8,97.7,99
30980,"Longview, TX (Metropolitan Statistical Area)",85.4,86.5,89.1,91.4,93,93.7,93.9,93.4,94.5,95.6,97
31020,"Longview, WA (Metropolitan Statistical Area)",89.3,90.4,91.9,92.8,94.2,96.5,97,99.1,101.1,102.9,105
31080,"Los Angeles-Long Beach-Anaheim, CA (Metropolitan Statistical Area)",109.2,112.5,115.7,117.4,118.9,120.3,119.9,120.8,124.1,127,129.3
31140,"Louisville/Jefferson County, KY-IN (Metropolitan Statistical Area)",85.8,86.7,88.9,90.6,92,93.4,93.7,93.4,94,96.1,97.6
31180,"Lubbock, TX (Metropolitan Statistical Area)",88.1,89.1,91.3,93.1,94.3,95.6,95.9,95.9,96.7,98.1,99.1
31340,"Lynchburg, VA (Metropolitan Statistical Area)",84.6,86,88.3,89.8,91.4,92.7,93.3,93.3,94.3,95.7,98.3
31420,"Macon-Bibb County, GA (Metropolitan Statistical Area)",81.4,83.7,85.5,87.4,88.7,89.5,89.2,89.3,91.1,93.5,95.2
31460,"Madera, CA (Metropolitan Statistical Area)",91.8,93.3,95.1,96.5,98.2,98.8,97.8,98.4,100.6,101.7,103.2
31540,"Madison, WI (Metropolitan Statistical Area)",91.3,92.7,95.3,97.2,98.4,99.8,99.2,99.9,101.3,103.4,104.9
31700,"Manchester-Nashua, NH (Metropolitan Statistical Area)",102.6,103.8,105.9,107.7,108.5,110.7,111.4,112.7,114.3,116,117.1
31740,"Manhattan, KS (Metropolitan Statistical Area)",85.3,87.4,90.7,93.1,95,96,95.6,95.8,97.1,98,98.6
31860,"Mankato, MN (Metropolitan Statistical Area)",82.5,84.7,86.1,89,89.4,92.2,91.7,93.7,96,98.3,99.7
31900,"Mansfield, OH (Metropolitan Statistical Area)",83,84.4,86.2,88,88.3,88.3,87.3,88.7,90,90.7,91.1
32580,"McAllen-Edinburg-Mission, TX (Metropolitan Statistical Area)",78.3,80,82.4,84.5,85.9,87.1,87.1,86.8,87.1,88.1,89.5
32780,"Medford, OR (Metropolitan Statistical Area)",92.2,93.9,97.1,98.1,99.7,100.3,100.1,101.3,103.2,105.2,107
32820,"Memphis, TN-MS-AR (Metropolitan Statistical Area)",86.6,87.6,90,91.7,93,93.9,93.9,93.4,94.3,96.1,97.5
32900,"Merced, CA (Metropolitan Statistical Area)",90.1,91.9,94.6,96,97.1,97.4,96.6,97.7,100.1,102.7,105.2
