"310M100US44420","Staunton-Waynesboro, VA Micro Area","185100","3254"
"310M100US44500","Stephenville, TX Micro Area","116300","7322"
"310M100US44540","Sterling, CO Micro Area","121400","9011"
"310M100US44580","Sterling, IL Micro Area","99700","2659"
"310M100US44600","Steubenville-Weirton, OH-WV Metro Area","86100","1857"
"310M100US44620","Stevens Point, WI Micro Area","144400","2656"
"310M100US44660","Stillwater, OK Micro Area","123100","4960"
"310M100US44700","Stockton, CA Metro Area","264600","3772"
"310M100US44740","Storm Lake, IA Micro Area","90800","4162"
"310M100US44780","Sturgis, MI Micro Area","113800","2759"
"310M100US44860","Sulphur Springs, TX Micro Area","93700","3887"
"310M100US44900","Summerville, GA Micro Area","78300","5284"
"310M100US44940","Sumter, SC Metro Area","100900","3247"
"310M100US44980","Sunbury, PA Micro Area","96000","2384"
"310M100US45000","Susanville, CA Micro Area","199200","12007"
"310M100US45020","Sweetwater, TX Micro Area","52400","6605"
"310M100US45060","Syracuse, NY Metro Area","119300","867"
"310M100US45140","Tahlequah, OK Micro Area","97100","5746"
"310M100US45180","Talladega-Sylacauga, AL Micro Area","89100","3779"
"310M100US45220","Tallahassee, FL Metro Area","173400","2253"
"310M100US45260","Tallulah, LA Micro Area","70200","8496"
"310M100US45300","Tampa-St. Petersburg-Clearwater, FL Metro Area","169900","940"
"310M100US45340","Taos, NM Micro Area","214000","17329"
"310M100US45380","Taylorville, IL Micro Area","82000","2504"
"310M100US45460","Terre Haute, IN Metro Area","86300","1551"
"310M100US45500","Texarkana, TX-Texarkana, AR Metro Area","90800","2464"
"310M100US45520","The Dalles, OR Micro Area","189300","7196"
"310M100US45540","The Villages, FL Micro Area","186800","4297"
"310M100US45580","Thomaston, GA Micro Area","92500","5680"
"310M100US45620","Thomasville, GA Micro Area","128100","9628"
"310M100US45640","Thomasville-Lexington, NC Micro Area","130200","3177"
"310M100US45660","Tiffin, OH Micro Area","102000","2905"
"310M100US45700","Tifton, GA Micro Area","109700","8399"
"310M100US45740","Toccoa, GA Micro Area","111700","7078"
"310M100US45780","Toledo, OH Metro Area","128100","1341"
"310M100US45820","Topeka, KS Metro Area","117200","1676"
"310M100US45860","Torrington, CT Micro Area","279600","3498"
"310M100US45900","Traverse City, MI Micro Area","170700","2455"
"310M100US45940","Trenton-Ewing, NJ Metro Area","302100","4149"
"310M100US45980","Troy, AL Micro Area","102800","10033"
"310M100US46020","Truckee-Grass Valley, CA Micro Area","412600","10048"
"310M100US46060","Tucson, AZ Metro Area","190500","1605"
"310M100US46100","Tullahoma, TN Micro Area","117700","2715"
"310M100US46140","Tulsa, OK Metro Area","125000","1007"
"310M100US46180","Tupelo, MS Micro Area","95700","2095"
"310M100US46220","Tuscaloosa, AL Metro Area","141200","2959"
"310M100US46260","Tuskegee, AL Micro Area","77900","5046"
"310M100US46300","Twin Falls, ID Micro Area","148200","3040"
"310M100US46340","Tyler, TX Metro Area","119800","2988"
"310M100US46380","Ukiah, CA Micro Area","380800","8746"
"310M100US46420","Union, SC Micro Area","73100","3550"
"310M100US46460","Union City, TN-KY Micro Area","83700","3257"
"310M100US46500","Urbana, OH Micro Area","123000","3918"
"310M100US46540","Utica-Rome, NY Metro Area","101300","1441"
"310M100US46580","Utuado, PR Micro Area","97200","5135"
"310M100US46620","Uvalde, TX Micro Area","67500","6884"
"310M100US46660","Valdosta, GA Metro Area","126500","3997"
"310M100US46700","Vallejo-Fairfield, CA Metro Area","340100","4216"
"310M100US46740","Valley, AL Micro Area","82400","2925"
"310M100US46780","Van Wert, OH Micro Area","88800","2546"
"310M100US46820","Vermillion, SD Micro Area","126000","12586"
"310M100US46860","Vernal, UT Micro Area","188700","6156"
"310M100US46900","Vernon, TX Micro Area","60700","8327"
"310M100US46980","Vicksburg, MS Micro Area","98500","3806"
"310M100US47020","Victoria, TX Metro Area","101200","2880"
"310M100US47080","Vidalia, GA Micro Area","85800","4649"
"310M100US47180","Vincennes, IN Micro Area","84700","3097"
"310M100US47220","Vineland-Millville-Bridgeton, NJ Metro Area","177800","3279"
"310M100US47260","Virginia Beach-Norfolk-Newport News, VA-NC Metro Area","246500","1181"
"310M100US47300","Visalia-Porterville, CA Metro Area","191500","2906"
"310M100US47340","Wabash, IN Micro Area","96700","4169"
"310M100US47380","Waco, TX Metro Area","104800","2215"
"310M100US47420","Wahpeton, ND-MN Micro Area","100300","4283"
"310M100US47460","Walla Walla, WA Micro Area","201600","6796"
"310M100US47500","Walterboro, SC Micro Area","92600","5101"
"310M100US47540","Wapakoneta, OH Micro Area","124700","3502"
"310M100US47580","Warner Robins, GA Metro Area","134200","3729"
"310M100US47620","Warren, PA Micro Area","85400","1723"
"310M100US47660","Warrensburg, MO Micro Area","135700","4746"
"310M100US47700","Warsaw, IN Micro Area","133100","4448"
"310M100US47780","Washington, IN Micro Area","100200","6311"
"310M100US47820","Washington, NC Micro Area","113600","7969"
"310M100US47900","Washington-Arlington-Alexandria, DC-VA-MD-WV Metro Area","399400","984"
"310M100US47920","Washington Court House, OH Micro Area","110000","3408"
"310M100US47940","Waterloo-Cedar Falls, IA Metro Area","123300","1674"
"310M100US47980","Watertown, SD Micro Area","126100","5175"
"310M100US48020","Watertown-Fort Atkinson, WI Micro Area","183100","3161"
"310M100US48060","Watertown-Fort Drum, NY Micro Area","124000","3332"
"310M100US48100","Wauchula, FL Micro Area","104100","9079"
"310M100US48140","Wausau, WI Metro Area","141700","1587"
"310M100US48180","Waycross, GA Micro Area","82800","4899"
"310M100US48220","Weatherford, OK Micro Area","94900","9379"
"310M100US48300","Wenatchee-East Wenatchee, WA Metro Area","240700","6153"
"310M100US48460","West Plains, MO Micro Area","98600","4660"
"310M100US48500","West Point, MS Micro Area","78200","5678"
"310M100US48540","Wheeling, WV-OH Metro Area","87100","1408"
"310M100US48580","Whitewater, WI Micro Area","198700","3319"
"310M100US48620","Wichita, KS Metro Area","118000","1078"
"310M100US48660","Wichita Falls, TX Metro Area","88400","1729"
"310M100US48700","Williamsport, PA Metro Area","125400","2775"
"310M100US48740","Willimantic, CT Micro Area","227000","3524"
"310M100US48780","Williston, ND Micro Area","110000","6387"
"310M100US48820","Willmar, MN Micro Area","162000","3609"
"310M100US48900","Wilmington, NC Metro Area","205600","3426"
"310M100US48940","Wilmington, OH Micro Area","123800","4116"
"310M100US48980","Wilson, NC Micro Area","114600","3426"
"310M100US49020","Winchester, VA-WV Metro Area","226600","4753"
"310M100US49060","Winfield, KS Micro Area","79900","2846"
"310M100US49100","Winona, MN Micro Area","160200","3236"
"310M100US49180","Winston-Salem, NC Metro Area","145300","1383"
"310M100US49260","Woodward, OK Micro Area","97600","6714"
"310M100US49300","Wooster, OH Micro Area","138200","2364"
"310M100US49340","Worcester, MA Metro Area","274900","1784"
"310M100US49380","Worthington, MN Micro Area","100100","4959"
"310M100US49420","Yakima, WA Metro Area","154800","2236"
"310M100US49460","Yankton, SD Micro Area","123000","5504"
"310M100US49500","Yauco, PR Metro Area","85100","1131"
"310M100US49540","Yazoo City, MS Micro Area","67000","4980"
"310M100US49620","York-Hanover, PA Metro Area","178400","1752"
"310M100US49660","Youngstown-Warren-Boardman, OH-PA Metro Area","99400","989"
"310M100US49700","Yuba City, CA Metro Area","216400","4873"
"310M100US49740","Yuma, AZ Metro Area","138600","3897"
"310M100US49780","Zanesville, OH Micro Area","111800","2534"
