"310M100US27300","Jacksonville, IL Micro Area","91500","3370"
"310M100US27340","Jacksonville, NC Metro Area","144300","2239"
"310M100US27380","Jacksonville, TX Micro Area","71000","4060"
"310M100US27420","Jamestown, ND Micro Area","92800","4857"
"310M100US27460","Jamestown-Dunkirk-Fredonia, NY Micro Area","80900","1534"
"310M100US27500","Janesville, WI Metro Area","139000","1671"
"310M100US27540","Jasper, IN Micro Area","118500","3787"
"310M100US27580","Jayuya, PR Micro Area","96500","3549"
"310M100US27620","Jefferson City, MO Metro Area","131600","2613"
"310M100US27660","Jennings, LA Micro Area","85400","2494"
"310M100US27700","Jesup, GA Micro Area","86400","5670"
"310M100US27740","Johnson City, TN Metro Area","123700","2412"
"310M100US27780","Johnstown, PA Metro Area","87600","1614"
"310M100US27860","Jonesboro, AR Metro Area","97100","2947"
"310M100US27900","Joplin, MO Metro Area","99500","2029"
"310M100US27940","Juneau, AK Micro Area","299100","10729"
"310M100US27980","Kahului-Wailuku, HI Micro Area","594400","9212"
"310M100US28020","Kalamazoo-Portage, MI Metro Area","139300","1536"
"310M100US28060","Kalispell, MT Micro Area","235200","5579"
"310M100US28100","Kankakee-Bradley, IL Metro Area","147700","3149"
"310M100US28140","Kansas City, MO-KS Metro Area","159600","652"
"310M100US28180","Kapaa, HI Micro Area","561600","16833"
"310M100US28260","Kearney, NE Micro Area","128300","4285"
"310M100US28300","Keene, NH Micro Area","202600","5321"
"310M100US28340","Kendallville, IN Micro Area","114500","3184"
"310M100US28380","Kennett, MO Micro Area","68500","3130"
"310M100US28420","Kennewick-Pasco-Richland, WA Metro Area","167500","1752"
"310M100US28500","Kerrville, TX Micro Area","136700","7959"
"310M100US28540","Ketchikan, AK Micro Area","254900","12533"
"310M100US28580","Key West, FL Micro Area","463100","18693"
"310M100US28620","Kill Devil Hills, NC Micro Area","321200","14669"
"310M100US28660","Killeen-Temple-Fort Hood, TX Metro Area","114500","2118"
"310M100US28700","Kingsport-Bristol-Bristol, TN-VA Metro Area","113500","1874"
"310M100US28740","Kingston, NY Metro Area","242500","3536"
"310M100US28780","Kingsville, TX Micro Area","71900","5693"
"310M100US28820","Kinston, NC Micro Area","93000","3727"
"310M100US28860","Kirksville, MO Micro Area","93200","4318"
"310M100US28900","Klamath Falls, OR Micro Area","172800","5203"
"310M100US28940","Knoxville, TN Metro Area","151800","1423"
"310M100US28980","Kodiak, AK Micro Area","214000","21178"
"310M100US29020","Kokomo, IN Metro Area","105700","2193"
"310M100US29060","Laconia, NH Micro Area","228100","4498"
"310M100US29100","La Crosse, WI-MN Metro Area","151700","2140"
"310M100US29140","Lafayette, IN Metro Area","123700","2053"
"310M100US29180","Lafayette, LA Metro Area","145500","3084"
"310M100US29220","La Follette, TN Micro Area","87900","2905"
"310M100US29260","La Grande, OR Micro Area","154100","6643"
"310M100US29300","LaGrange, GA Micro Area","129100","4787"
"310M100US29340","Lake Charles, LA Metro Area","116600","2733"
"310M100US29380","Lake City, FL Micro Area","127100","8418"
"310M100US29420","Lake Havasu City-Kingman, AZ Metro Area","158200","3283"
"310M100US29460","Lakeland-Winter Haven, FL Metro Area","133200","2121"
"310M100US29500","Lamesa, TX Micro Area","48100","4036"
"310M100US29540","Lancaster, PA Metro Area","187300","1386"
"310M100US29580","Lancaster, SC Micro Area","133200","6256"
"310M100US29620","Lansing-East Lansing, MI Metro Area","143600","1378"
"310M100US29660","Laramie, WY Micro Area","194900","6225"
"310M100US29700","Laredo, TX Metro Area","106500","2556"
"310M100US29740","Las Cruces, NM Metro Area","141900","4086"
"310M100US29780","Las Vegas, NM Micro Area","118000","7128"
"310M100US29820","Las Vegas-Paradise, NV Metro Area","226200","1732"
"310M100US29860","Laurel, MS Micro Area","81100","2996"
"310M100US29900","Laurinburg, NC Micro Area","75600","3394"
"310M100US29940","Lawrence, KS Metro Area","179900","2947"
"310M100US29980","Lawrenceburg, TN Micro Area","95300","3892"
"310M100US30020","Lawton, OK Metro Area","106300","3047"
"310M100US30060","Lebanon, MO Micro Area","94400","4811"
"310M100US30100","Lebanon, NH-VT Micro Area","204400","3847"
"310M100US30140","Lebanon, PA Metro Area","160800","2240"
"310M100US30220","Levelland, TX Micro Area","77000","4146"
"310M100US30260","Lewisburg, PA Micro Area","148500","4751"
"310M100US30280","Lewisburg, TN Micro Area","106000","6082"
"310M100US30300","Lewiston, ID-WA Metro Area","165900","3121"
"310M100US30340","Lewiston-Auburn, ME Metro Area","157100","2228"
"310M100US30380","Lewistown, PA Micro Area","93400","2325"
"310M100US30420","Lexington, NE Micro Area","86400","2747"
"310M100US30460","Lexington-Fayette, KY Metro Area","158600","1620"
"310M100US30500","Lexington Park, MD Micro Area","324500","6025"
"310M100US30580","Liberal, KS Micro Area","86500","4828"
"310M100US30620","Lima, OH Metro Area","105400","3030"
"310M100US30660","Lincoln, IL Micro Area","95700","2893"
"310M100US30700","Lincoln, NE Metro Area","145800","1190"
"310M100US30740","Lincolnton, NC Micro Area","151900","5211"
"310M100US30780","Little Rock-North Little Rock-Conway, AR Metro Area","132200","1390"
"310M100US30820","Lock Haven, PA Micro Area","101000","3363"
"310M100US30860","Logan, UT-ID Metro Area","183000","3202"
"310M100US30900","Logansport, IN Micro Area","82400","2504"
"310M100US30940","London, KY Micro Area","95800","4803"
"310M100US30980","Longview, TX Metro Area","102900","2398"
"310M100US31020","Longview, WA Metro Area","193800","4200"
"310M100US31060","Los Alamos, NM Micro Area","300700","13389"
"310M100US31100","Los Angeles-Long Beach-Santa Ana, CA Metro Area","501900","1949"
"310M100US31140","Louisville/Jefferson County, KY-IN Metro Area","145900","892"
"310M100US31180","Lubbock, TX Metro Area","104100","1933"
"310M100US31260","Lufkin, TX Micro Area","82900","2554"
"310M100US31300","Lumberton, NC Micro Area","68900","2230"
"310M100US31340","Lynchburg, VA Metro Area","157300","2372"
"310M100US31380","Macomb, IL Micro Area","87000","2539"
"310M100US31420","Macon, GA Metro Area","120000","2511"
"310M100US31460","Madera-Chowchilla, CA Metro Area","245500","6366"
"310M100US31500","Madison, IN Micro Area","109900","5331"
"310M100US31540","Madison, WI Metro Area","223500","1251"
"310M100US31580","Madisonville, KY Micro Area","79700","3146"
"310M100US31620","Magnolia, AR Micro Area","79500","5890"
"310M100US31660","Malone, NY Micro Area","91400","2808"
"310M100US31700","Manchester-Nashua, NH Metro Area","265100","2028"
"310M100US31740","Manhattan, KS Metro Area","150900","3723"
"310M100US31820","Manitowoc, WI Micro Area","125600","2320"
"310M100US31860","Mankato-North Mankato, MN Metro Area","165000","2108"
"310M100US31900","Mansfield, OH Metro Area","110900","2472"
"310M100US31920","Marble Falls, TX Micro Area","141500","9957"
"310M100US31940","Marinette, WI-MI Micro Area","104900","2588"
"310M100US31980","Marion, IN Micro Area","82500","2809"
"310M100US32020","Marion, OH Micro Area","99200","2638"
"310M100US32060","Marion-Herrin, IL Micro Area","89100","2934"
"310M100US32100","Marquette, MI Micro Area","127700","3859"
"310M100US32140","Marshall, MN Micro Area","137600","4724"
"310M100US32180","Marshall, MO Micro Area","82800","3305"
"310M100US32220","Marshall, TX Micro Area","104600","6722"
"310M100US32260","Marshalltown, IA Micro Area","102700","3537"
"310M100US32270","Marshfield-Wisconsin Rapids, WI Micro Area","117900","2147"
"310M100US32280","Martin, TN Micro Area","84400","3763"
"310M100US32300","Martinsville, VA Micro Area","93000","3475"
"310M100US32340","Maryville, MO Micro Area","98300","6353"
"310M100US32380","Mason City, IA Micro Area","107500","4126"
"310M100US32420","Mayagüez, PR Metro Area","91400","2728"
"310M100US32460","Mayfield, KY Micro Area","84100","3330"
"310M100US32500","Maysville, KY Micro Area","77200","4529"
"310M100US32540","McAlester, OK Micro Area","84800","3216"
"310M100US32580","McAllen-Edinburg-Mission, TX Metro Area","75500","1447"
"310M100US32620","McComb, MS Micro Area","80700","3917"
"310M100US32660","McMinnville, TN Micro Area","90500","3954"
"310M100US32700","McPherson, KS Micro Area","119000","3558"
"310M100US32740","Meadville, PA Micro Area","100400","2354"
"310M100US32780","Medford, OR Metro Area","262500","5261"
"310M100US32820","Memphis, TN-MS-AR Metro Area","136700","1428"
"310M100US32860","Menomonie, WI Micro Area","158300","3515"
"310M100US32900","Merced, CA Metro Area","197700","6148"
"310M100US32940","Meridian, MS Micro Area","78400","2924"
"310M100US32980","Merrill, WI Micro Area","131000","4800"
"310M100US33020","Mexico, MO Micro Area","83900","3426"
"310M100US33060","Miami, OK Micro Area","80200","2382"
"310M100US33100","Miami-Fort Lauderdale-Pompano Beach, FL Metro Area","236900","951"
"310M100US33140","Michigan City-La Porte, IN Metro Area","120500","2530"
"310M100US33180","Middlesborough, KY Micro Area","63900","5624"
"310M100US33220","Midland, MI Micro Area","131900","2850"
"310M100US33260","Midland, TX Metro Area","133100","4842"
"310M100US33300","Milledgeville, GA Micro Area","103000","7911"
"310M100US33340","Milwaukee-Waukesha-West Allis, WI Metro Area","205100","1205"
"310M100US33380","Minden, LA Micro Area","79900","3480"
"310M100US33420","Mineral Wells, TX Micro Area","81600","3313"
"310M100US33460","Minneapolis-St. Paul-Bloomington, MN-WI Metro Area","234000","592"
"310M100US33500","Minot, ND Micro Area","118000","2776"
"310M100US33540","Missoula, MT Metro Area","239000","4105"
"310M100US33580","Mitchell, SD Micro Area","110500","6860"
"310M100US33620","Moberly, MO Micro Area","81300","4102"
"310M100US33660","Mobile, AL Metro Area","124100","1986"
"310M100US33700","Modesto, CA Metro Area","232000","3796"
"310M100US33740","Monroe, LA Metro Area","109500","4048"
"310M100US33780","Monroe, MI Metro Area","156600","2179"
"310M100US33820","Monroe, WI Micro Area","154000","3796"
"310M100US33860","Montgomery, AL Metro Area","128700","1981"
"310M100US33940","Montrose, CO Micro Area","202200","7702"
"310M100US33980","Morehead City, NC Micro Area","208200","7580"
"310M100US34020","Morgan City, LA Micro Area","87200","3048"
"310M100US34060","Morgantown, WV Metro Area","132200","4093"
"310M100US34100","Morristown, TN Metro Area","115000","2789"
"310M100US34140","Moscow, ID Micro Area","187300","8599"
"310M100US34180","Moses Lake, WA Micro Area","152300","6533"
"310M100US34220","Moultrie, GA Micro Area","85600","3904"
"310M100US34260","Mountain Home, AR Micro Area","121900","4267"
"310M100US34300","Mountain Home, ID Micro Area","144400","5261"
"310M100US34340","Mount Airy, NC Micro Area","105000","4058"
"310M100US34380","Mount Pleasant, MI Micro Area","124100","2790"
"310M100US34420","Mount Pleasant, TX Micro Area","88300","4121"
"310M100US34460","Mount Sterling, KY Micro Area","85600","3800"
"310M100US34500","Mount Vernon, IL Micro Area","84600","2724"
"310M100US34540","Mount Vernon, OH Micro Area","134600","4063"
"310M100US34580","Mount Vernon-Anacortes, WA Metro Area","280800","5307"
"310M100US34620","Muncie, IN Metro Area","92200","1673"
"310M100US34660","Murray, KY Micro Area","112300","5785"
"310M100US34700","Muscatine, IA Micro Area","112500","4681"
"310M100US34740","Muskegon-Norton Shores, MI Metro Area","108700","1782"
"310M100US34780","Muskogee, OK Micro Area","88000","2751"
"310M100US34820","Myrtle Beach-North Myrtle Beach-Conway, SC Metro Area","170600","2414"
"310M100US34860","Nacogdoches, TX Micro Area","90800","4490"
"310M100US34900","Napa, CA Metro Area","521700","16598"
"310M100US34940","Naples-Marco Island, FL Metro Area","317200","6593"
"310M100US34980","Nashville-Davidson--Murfreesboro--Franklin, TN Metro Area","172700","983"
"310M100US35020","Natchez, MS-LA Micro Area","80000","4528"
"310M100US35060","Natchitoches, LA Micro Area","94700","3766"
"310M100US35100","New Bern, NC Micro Area","148400","4491"
"310M100US35140","Newberry, SC Micro Area","104200","6086"
"310M100US35220","New Castle, IN Micro Area","94400","2922"
"310M100US35260","New Castle, PA Micro Area","94400","2372"
"310M100US35300","New Haven-Milford, CT Metro Area","270900","1661"
"310M100US35340","New Iberia, LA Micro Area","102600","4428"
"310M100US35380","New Orleans-Metairie-Kenner, LA Metro Area","179500","1103"
"310M100US35420","New Philadelphia-Dover, OH Micro Area","110000","2408"
"310M100US35460","Newport, TN Micro Area","98000","6174"
"310M100US35500","Newton, IA Micro Area","114000","3988"
"310M100US35580","New Ulm, MN Micro Area","122400","4096"
"310M100US35620","New York-Northern New Jersey-Long Island, NY-NJ-PA Metro Area","440400","828"
"310M100US35660","Niles-Benton Harbor, MI Metro Area","135400","2680"
"310M100US35700","Nogales, AZ Micro Area","152700","7165"
"310M100US35740","Norfolk, NE Micro Area","98900","2996"
"310M100US35820","North Platte, NE Micro Area","110900","3449"
"310M100US35840","North Port-Bradenton-Sarasota, FL Metro Area","205700","2711"
"310M100US35860","North Vernon, IN Micro Area","90500","3487"
"310M100US35900","North Wilkesboro, NC Micro Area","112200","4583"
"310M100US35940","Norwalk, OH Micro Area","121400","2874"
"310M100US35980","Norwich-New London, CT Metro Area","265700","3230"
"310M100US36020","Oak Harbor, WA Micro Area","312000","8807"
"310M100US36060","Oak Hill, WV Micro Area","70700","2796"
"310M100US36100","Ocala, FL Metro Area","142000","2607"
"310M100US36140","Ocean City, NJ Metro Area","332400","6679"
"310M100US36180","Ocean Pines, MD Micro Area","279600","8659"
"310M100US36220","Odessa, TX Metro Area","83100","2672"
"310M100US36260","Ogden-Clearfield, UT Metro Area","205900","1961"
"310M100US36300","Ogdensburg-Massena, NY Micro Area","80900","1932"
"310M100US36340","Oil City, PA Micro Area","78500","2118"
"310M100US36380","Okeechobee, FL Micro Area","124300","7469"
"310M100US36420","Oklahoma City, OK Metro Area","125900","958"
"310M100US36460","Olean, NY Micro Area","78400","1197"
"310M100US36500","Olympia, WA Metro Area","259500","3557"
"310M100US36540","Omaha-Council Bluffs, NE-IA Metro Area","144800","659"
"310M100US36580","Oneonta, NY Micro Area","131100","4509"
"310M100US36620","Ontario, OR-ID Micro Area","139300","5977"
"310M100US36660","Opelousas-Eunice, LA Micro Area","84700","2423"
"310M100US36700","Orangeburg, SC Micro Area","81300","3726"
"310M100US36740","Orlando-Kissimmee-Sanford, FL Metro Area","201100","1493"
"310M100US36780","Oshkosh-Neenah, WI Metro Area","140800","1749"
"310M100US36820","Oskaloosa, IA Micro Area","97000","5175"
"310M100US36860","Ottawa-Streator, IL Micro Area","120900","1940"
"310M100US36900","Ottumwa, IA Micro Area","76800","2291"
"310M100US36940","Owatonna, MN Micro Area","158800","2647"
"310M100US36980","Owensboro, KY Metro Area","102200","2557"
"310M100US37020","Owosso, MI Micro Area","122800","2644"
"310M100US37060","Oxford, MS Micro Area","158000","9377"
"310M100US37100","Oxnard-Thousand Oaks-Ventura, CA Metro Area","515900","5390"
"310M100US37140","Paducah, KY-IL Micro Area","99400","3203"
"310M100US37220","Pahrump, NV Micro Area","142800","9400"
"310M100US37260","Palatka, FL Micro Area","105300","4757"
"310M100US37300","Palestine, TX Micro Area","82900","3451"
"310M100US37340","Palm Bay-Melbourne-Titusville, FL Metro Area","171200","1630"
"310M100US37380","Palm Coast, FL Metro Area","201300","5880"
"310M100US37420","Pampa, TX Micro Area","72700","4951"
"310M100US37460","Panama City-Lynn Haven-Panama City Beach, FL Metro Area","168400","3282"
"310M100US37500","Paragould, AR Micro Area","92800","4430"
"310M100US37540","Paris, TN Micro Area","87700","3633"
"310M100US37580","Paris, TX Micro Area","84300","4014"
"310M100US37620","Parkersburg-Marietta-Vienna, WV-OH Metro Area","104300","2054"
"310M100US37660","Parsons, KS Micro Area","63500","2794"
"310M100US37700","Pascagoula, MS Metro Area","124700","3709"
"310M100US37740","Payson, AZ Micro Area","154200","6630"
"310M100US37780","Pecos, TX Micro Area","35300","4271"
"310M100US37800","Pella, IA Micro Area","132300","7007"
"310M100US37820","Pendleton-Hermiston, OR Micro Area","140200","5092"
"310M100US37860","Pensacola-Ferry Pass-Brent, FL Metro Area","155100","1894"
"310M100US37900","Peoria, IL Metro Area","125900","1580"
"310M100US37940","Peru, IN Micro Area","86800","2577"
"310M100US37980","Philadelphia-Camden-Wilmington, PA-NJ-DE-MD Metro Area","245000","662"
"310M100US38020","Phoenix Lake-Cedar Ridge, CA Micro Area","304700","12533"
"310M100US38060","Phoenix-Mesa-Glendale, AZ Metro Area","212100","988"
"310M100US38100","Picayune, MS Micro Area","119100","5862"
"310M100US38180","Pierre, SD Micro Area","141500","7251"
"310M100US38200","Pierre Part, LA Micro Area","89100","6238"
"310M100US38220","Pine Bluff, AR Metro Area","76400","1929"
"310M100US38260","Pittsburg, KS Micro Area","85200","3351"
"310M100US38300","Pittsburgh, PA Metro Area","121100","664"
"310M100US38340","Pittsfield, MA Metro Area","208100","4956"
"310M100US38380","Plainview, TX Micro Area","73500","3122"
"310M100US38420","Platteville, WI Micro Area","121500","2477"
"310M100US38460","Plattsburgh, NY Micro Area","119600","3000"
"310M100US38500","Plymouth, IN Micro Area","124300","3882"
"310M100US38540","Pocatello, ID Metro Area","139800","2494"
"310M100US38580","Point Pleasant, WV-OH Micro Area","88900","3056"
"310M100US38620","Ponca City, OK Micro Area","76900","2622"
"310M100US38660","Ponce, PR Metro Area","103100","1506"
"310M100US38700","Pontiac, IL Micro Area","105600","3984"
"310M100US38740","Poplar Bluff, MO Micro Area","86200","4245"
"310M100US38780","Portales, NM Micro Area","104300","8318"
"310M100US38820","Port Angeles, WA Micro Area","239800","6030"
"310M100US38860","Portland-South Portland-Biddeford, ME Metro Area","237600","1528"
"310M100US38900","Portland-Vancouver-Hillsboro, OR-WA Metro Area","284400","1013"
"310M100US38940","Port St. Lucie, FL Metro Area","175100","3205"
"310M100US39020","Portsmouth, OH Micro Area","87500","2983"
"310M100US39060","Pottsville, PA Micro Area","91200","1911"
"310M100US39100","Poughkeepsie-Newburgh-Middletown, NY Metro Area","306800","2817"
"310M100US39140","Prescott, AZ Metro Area","216900","5227"
"310M100US39220","Price, UT Micro Area","117200","7153"
"310M100US39260","Prineville, OR Micro Area","220400","10872"
"310M100US39300","Providence-New Bedford-Fall River, RI-MA Metro Area","280300","1072"
"310M100US39340","Provo-Orem, UT Metro Area","233300","1825"
"310M100US39380","Pueblo, CO Metro Area","140700","2210"
"310M100US39420","Pullman, WA Micro Area","187600","8480"
"310M100US39460","Punta Gorda, FL Metro Area","166700","3207"
"310M100US39500","Quincy, IL-MO Micro Area","97200","2069"
"310M100US39540","Racine, WI Metro Area","177300","3039"
"310M100US39580","Raleigh-Cary, NC Metro Area","202900","1811"
"310M100US39660","Rapid City, SD Metro Area","153600","2438"
"310M100US39700","Raymondville, TX Micro Area","51400","4523"
"310M100US39740","Reading, PA Metro Area","174000","1699"
"310M100US39780","Red Bluff, CA Micro Area","208000","7981"
"310M100US39820","Redding, CA Metro Area","246800","3969"
"310M100US39860","Red Wing, MN Micro Area","188000","3648"
"310M100US39900","Reno-Sparks, NV Metro Area","256700","5044"
"310M100US39940","Rexburg, ID Micro Area","163100","4988"
"310M100US39980","Richmond, IN Micro Area","98200","2458"
"310M100US40060","Richmond, VA Metro Area","227600","1257"
"310M100US40080","Richmond-Berea, KY Micro Area","127100","4686"
"310M100US40100","Rio Grande City-Roma, TX Micro Area","59900","3243"
"310M100US40140","Riverside-San Bernardino-Ontario, CA Metro Area","281600","1696"
"310M100US40180","Riverton, WY Micro Area","166500","5580"
"310M100US40220","Roanoke, VA Metro Area","168600","1792"
"310M100US40260","Roanoke Rapids, NC Micro Area","83800","2614"
"310M100US40300","Rochelle, IL Micro Area","153400","3169"
"310M100US40340","Rochester, MN Metro Area","170500","1463"
"310M100US40380","Rochester, NY Metro Area","126600","1073"
"310M100US40420","Rockford, IL Metro Area","134900","1272"
"310M100US40460","Rockingham, NC Micro Area","74000","3436"
"310M100US40500","Rockland, ME Micro Area","202800","8071"
"310M100US40540","Rock Springs, WY Micro Area","180300","9812"
"310M100US40580","Rocky Mount, NC Metro Area","101800","3109"
"310M100US40620","Rolla, MO Micro Area","112700","5712"
"310M100US40660","Rome, GA Metro Area","120000","3918"
"310M100US40700","Roseburg, OR Micro Area","186400","5102"
"310M100US40740","Roswell, NM Micro Area","90000","4602"
"310M100US40760","Ruidoso, NM Micro Area","168900","15815"
"310M100US40780","Russellville, AR Micro Area","96200","3652"
"310M100US40820","Ruston, LA Micro Area","94800","6663"
"310M100US40860","Rutland, VT Micro Area","175200","4257"
"310M100US40900","Sacramento--Arden-Arcade--Roseville, CA Metro Area","324300","1700"
"310M100US40940","Safford, AZ Micro Area","112800","6519"
"310M100US40980","Saginaw-Saginaw Township North, MI Metro Area","106400","1947"
"310M100US41060","St. Cloud, MN Metro Area","171100","1521"
"310M100US41100","St. George, UT Metro Area","235300","4311"
"310M100US41140","St. Joseph, MO-KS Metro Area","108900","2418"
"310M100US41180","St. Louis, MO-IL Metro Area","160400","591"
"310M100US41220","St. Marys, GA Micro Area","163000","4545"
"310M100US41260","St. Marys, PA Micro Area","94000","3379"
"310M100US41420","Salem, OR Metro Area","212000","2318"
"310M100US41460","Salina, KS Micro Area","112700","3589"
"310M100US41500","Salinas, CA Metro Area","497400","11086"
"310M100US41540","Salisbury, MD Metro Area","190200","4113"
"310M100US41580","Salisbury, NC Micro Area","127200","3167"
"310M100US41620","Salt Lake City, UT Metro Area","241000","1340"
"310M100US41660","San Angelo, TX Metro Area","90700","2894"
"310M100US41700","San Antonio-New Braunfels, TX Metro Area","127200","1009"
"310M100US41740","San Diego-Carlsbad-San Marcos, CA Metro Area","455000","2171"
"310M100US41780","Sandusky, OH Metro Area","138000","3260"
"310M100US41820","Sanford, NC Micro Area","135500","5622"
"310M100US41860","San Francisco-Oakland-Fremont, CA Metro Area","627000","2186"
"310M100US41900","San Germán-Cabo Rojo, PR Metro Area","97800","1487"
"310M100US41940","San Jose-Sunnyvale-Santa Clara, CA Metro Area","674800","2969"
"310M100US41980","San Juan-Caguas-Guaynabo, PR Metro Area","129900","762"
"310M100US42020","San Luis Obispo-Paso Robles, CA Metro Area","480200","6884"
"310M100US42060","Santa Barbara-Santa Maria-Goleta, CA Metro Area","523800","14665"
"310M100US42100","Santa Cruz-Watsonville, CA Metro Area","613500","9642"
"310M100US42140","Santa Fe, NM Metro Area","293900","7116"
"310M100US42180","Santa Isabel, PR Micro Area","94000","3812"
"310M100US42220","Santa Rosa-Petaluma, CA Metro Area","477300","5432"
"310M100US42300","Sault Ste. Marie, MI Micro Area","103700","3081"
"310M100US42340","Savannah, GA Metro Area","172400","2125"
"310M100US42380","Sayre, PA Micro Area","108600","2588"
"310M100US42420","Scottsbluff, NE Micro Area","95500","3602"
"310M100US42460","Scottsboro, AL Micro Area","88900","3287"
"310M100US42500","Scottsburg, IN Micro Area","98300","5064"
"310M100US42540","Scranton--Wilkes-Barre, PA Metro Area","126600","1673"
"310M100US42580","Seaford, DE Micro Area","246900","3499"
"310M100US42620","Searcy, AR Micro Area","94400","3932"
"310M100US42660","Seattle-Tacoma-Bellevue, WA Metro Area","352800","1128"
"310M100US42680","Sebastian-Vero Beach, FL Metro Area","179300","5620"
"310M100US42700","Sebring, FL Micro Area","115600","3887"
"310M100US42740","Sedalia, MO Micro Area","97700","3919"
"310M100US42780","Selinsgrove, PA Micro Area","128300","4189"
"310M100US42820","Selma, AL Micro Area","70200","3949"
"310M100US42860","Seneca, SC Micro Area","134600","6130"
"310M100US42900","Seneca Falls, NY Micro Area","90600","3412"
"310M100US42940","Sevierville, TN Micro Area","158700","3381"
"310M100US42980","Seymour, IN Micro Area","117400","3456"
"310M100US43060","Shawnee, OK Micro Area","92500","3170"
"310M100US43100","Sheboygan, WI Metro Area","154300","2097"
"310M100US43140","Shelby, NC Micro Area","104300","3683"
"310M100US43180","Shelbyville, TN Micro Area","114200","5260"
"310M100US43220","Shelton, WA Micro Area","223800","6757"
"310M100US43260","Sheridan, WY Micro Area","224900","10846"
"310M100US43300","Sherman-Denison, TX Metro Area","102300","2988"
"310M100US43320","Show Low, AZ Micro Area","130400","8795"
"310M100US43340","Shreveport-Bossier City, LA Metro Area","121300","2411"
"310M100US43380","Sidney, OH Micro Area","124300","3513"
"310M100US43420","Sierra Vista-Douglas, AZ Micro Area","155700","3732"
"310M100US43460","Sikeston, MO Micro Area","95600","3855"
"310M100US43500","Silver City, NM Micro Area","133000","8293"
"310M100US43540","Silverthorne, CO Micro Area","465200","23124"
"310M100US43580","Sioux City, IA-NE-SD Metro Area","97800","1594"
"310M100US43620","Sioux Falls, SD Metro Area","150300","1975"
"310M100US43660","Snyder, TX Micro Area","78200","6625"
"310M100US43700","Somerset, KY Micro Area","97600","4292"
"310M100US43740","Somerset, PA Micro Area","94200","2860"
"310M100US43780","South Bend-Mishawaka, IN-MI Metro Area","119000","1570"
"310M100US43860","Southern Pines-Pinehurst, NC Micro Area","192500","5292"
"310M100US43900","Spartanburg, SC Metro Area","118800","2069"
"310M100US43940","Spearfish, SD Micro Area","163700","6400"
"310M100US43980","Spencer, IA Micro Area","99500","4883"
"310M100US44020","Spirit Lake, IA Micro Area","157900","7059"
"310M100US44060","Spokane, WA Metro Area","192800","1875"
"310M100US44100","Springfield, IL Metro Area","120600","1832"
"310M100US44140","Springfield, MA Metro Area","219700","1405"
"310M100US44180","Springfield, MO Metro Area","129300","1522"
"310M100US44220","Springfield, OH Metro Area","110400","2049"
"310M100US44260","Starkville, MS Micro Area","108100","8980"
"310M100US44300","State College, PA Metro Area","181400","3960"
"310M100US44340","Statesboro, GA Micro Area","140100","7907"
"310M100US44380","Statesville-Mooresville, NC Micro Area","168300","3471"
